1,2,Example
Premium,Higher price to show image of superiority or quality,Rolex
Price skimming,"High price to start, drop price later to get more sales after",PS4 Game
Penetration,"Lower price to start, to build market share",Aldi/Lidl
Psychological,Price at perceived cheaper amounts €19.99 vs €20,Travel Agent
Bundle,Lower price per item when bought as a package,TV/broadband
Cost plus,Price to cover all costs (ads/production) plus percentage profit,Clothes retailers
Tiered,Selling different levels of quality at different price ranges,Cars (add-ons)
Discrimination,Selling goods at different prices to different groups,Dublin Bus
Predatory,Lower prices to eliminate competitors,Ryanair